{
  "schema_version": "1.0.0",
  "source_of_truth": "image-prompt-templates.fa.json",
  "brand_style": "هویت تصویری آهنگ‌بان: زمینه‌های مشکی/زغالی و سفید، آبی اصلی ثابت #185ADB، مینیمال و فارسی‌محور، بدون گرادینت، با فضای منفی کافی. از لوگو، نوشته یا نشان ساختگی استفاده نشود.",
  "artist_portrait": {
    "title": "پرترهٔ هماهنگ هنرمند",
    "dimensions": "500×500 پیکسل، مربع، نسبت 1:1",
    "input_requirement": "یک عکس مرجع از همان هنرمند به مدل تصویر بدهید؛ فقط نام هنرمند را در فرم وارد کنید.",
    "template": "با استفاده از عکس پیوست به‌عنوان تنها مرجع هویت، یک پرترهٔ ادیتوریال حرفه‌ای و یکپارچه برای پروفایل هنرمند در برند آهنگ‌بان بساز. نام هنرمند برای زمینهٔ تحریریه: «{{artist_name}}». خروجی دقیقاً مربع 1:1 و 500×500 پیکسل باشد. هویت فرد را دقیقاً حفظ کن: ساختار و ویژگی‌های چهره، رنگ پوست، سن ظاهری، جنسیت، مو و نشانه‌های قابل‌شناسایی تغییر نکنند؛ چهره را با فرد دیگری جایگزین نکن، جوان‌سازی/زیباسازی افراطی نکن و ویژگی فرهنگی را کلیشه‌ای نکن. سبک کلی: عکاسی پرترهٔ معاصر، طبیعی، با نور استودیویی نرم و کنتراست کنترل‌شده؛ پس‌زمینهٔ ساده و عمیق با مشکی #111111 یا زغالی #222222، سفیدی محدود و یک تأکید آبی ثابت #185ADB. بدون گرادینت، قاب تزئینی شلوغ، موج صوتی بزرگ، میکروفون ساختگی، متن، حروف، واترمارک یا لوگوی ساختگی. صورت در قاب مرکزی و خوانا بماند و از لبه‌ها فاصلهٔ امن حداقل 10 درصد داشته باشد تا در برش دایره‌ای پروفایل قطع نشود. جزئیات طبیعی عکس را حفظ کن؛ ظاهر هنرمند را به پوستر تبلیغاتی یا شخصیت خیالی تبدیل نکن. خروجی تمیز، قابل‌استفاده در وب و هماهنگ با رابط فارسی‌محور آهنگ‌بان باشد."
  },
  "featured_slider": {
    "title": "پس‌زمینهٔ اسلایدر ویژهٔ آهنگ",
    "dimensions": "640×360 پیکسل، افقی، نسبت 16:9",
    "input_requirement": "نام هنرمند و عنوان آهنگ را در فرم بنویسید و کاور اصلیِ مجاز همان آهنگ را به مدل تصویر پیوست کنید.",
    "template": "برای اسلایدر ویژهٔ آهنگ‌بان یک بنر تصویری افقی با ابعاد دقیق 640×360 پیکسل و نسبت 16:9 طراحی کن. هنرمند: «{{artist_name}}». عنوان آهنگ: «{{track_title}}». کاور پیوست، مرجع اصلیِ این آهنگ است؛ حال‌وهوا و رنگ‌بندی کلی را از آن الهام بگیر اما محتوای خود کاور را بازطراحی، تقلید، نقاشی، تعویض یا دست‌کاری نکن. در خروجی یک فضای خالی و تمیز در یک‌سوم سمت چپ برای قرارگرفتن نسخهٔ اصلی کاور نگه دار؛ خود کاور را دوباره تولید نکن و نوشته‌های آن را بازسازی نکن. دو سوم سمت راست را به پس‌زمینهٔ ادیتوریال ساده و هماهنگ با آهنگ‌بان اختصاص بده و فضای امن کافی برای عنوان فارسی در چیدمان RTL باقی بگذار: مشکی #111111 و زغالی #222222، سفیدی کنترل‌شده و فقط یک تأکید آبی ثابت #185ADB. بدون گرادینت، بدون شلوغی، بدون نماد کلیشه‌ای موسیقی، بدون چهرهٔ ساختگی، بدون لوگو یا واترمارک. هیچ متن، حرف، عدد، نام هنرمند یا عنوان آهنگ را داخل تصویر رندر نکن؛ متن فارسی بعداً در خود سایت روی بنر قرار می‌گیرد تا درست و خوانا نمایش داده شود. کنتراست و فضای منفی مناسب رابط RTL حفظ شود؛ سوژه‌ها/بافت‌ها را در ناحیهٔ امن نگه دار و لبهٔ مهمی را قطع نکن. خروجی فقط یک پس‌زمینهٔ بنرِ تمیز و باکیفیت باشد، نه موکاپ دستگاه و نه چند تصویر کنار هم."
  },
  "production_note": "برای حفظ دقیق و بدون تغییر کاور اصلی، خروجی هوش مصنوعی را پس‌زمینه تلقی کنید و فایل کاور اصلی را در مرحلهٔ نهایی با ابزار طراحی/کد سایت به‌صورت لایهٔ مستقل روی فضای خالی قرار دهید. اگر مدل تصویر کاور را تغییر داد، کاور تولیدی را جایگزین فایل اصلی نکنید. استفاده از عکس هنرمند، کاور و نام‌ها باید مجاز و دارای منشأ باشد. متن فارسی و لوگو را ترجیحاً در HTML/CSS سایت اضافه کنید، نه در تصویر تولیدشده."
}
